{
  "schema_version": 1,
  "selector": {
    "item": "minecraft:rabbit"
  },
  "quality": "basic",
  "diet": {
    "categories": [
      "protein"
    ],
    "variety_group": "minecraft:cooked_chicken"
  },
  "recovery": {
    "health": 0.5
  },
  "hydration": {
    "thirst": 2,
    "quenched": 0
  }
}
