{
  "schema_version": 1,
  "selector": {
    "item": "minecraft:mushroom_stew"
  },
  "quality": "meal",
  "recovery": {
    "health": 3
  },
  "hydration": {
    "thirst": 6,
    "quenched": 4
  },
  "diet": {
    "categories": [
      "vegetable"
    ],
    "variety_group": "minecraft:mushroom_stew"
  },
  "traits": [
    "soup",
    "warm"
  ],
  "meal_benefit": "buildup_vitals:restorative"
}
