{
  "schema_version": 1,
  "selector": {
    "item": "minecraft:chorus_fruit"
  },
  "quality": "basic",
  "hydration": {
    "thirst": 3,
    "quenched": 1
  },
  "diet": {
    "categories": [
      "fruit"
    ],
    "variety_group": "minecraft:chorus_fruit"
  },
  "recovery": {
    "health": 0.5
  }
}
