{
  "schema_version": 1,
  "selector": {
    "item": "minecraft:cooked_porkchop"
  },
  "quality": "basic",
  "diet": {
    "categories": [
      "protein"
    ],
    "variety_group": "minecraft:cooked_beef"
  },
  "recovery": {
    "health": 1
  },
  "hydration": {
    "thirst": 1,
    "quenched": 0
  }
}
