{
  "schema_version": 1,
  "selector": {
    "item": "minecraft:golden_carrot"
  },
  "quality": "basic",
  "diet": {
    "categories": [
      "vegetable"
    ],
    "variety_group": "minecraft:carrot"
  },
  "recovery": {
    "health": 1
  },
  "hydration": {
    "thirst": 2,
    "quenched": 1
  }
}
